{
  "schema": "sauti.approval_record",
  "schema_version": "1.1.0",
  "approval_id": "22222222-3333-4444-8555-666666666666",
  "action_id": "5a5a5a5a-9abc-4def-8abc-fedcba987654",
  "digest": "dcfee4695e6a005997f57fcdd64cfd79a9add82db8a98db0055db05cf9f4410f",
  "fact_revision": 1,
  "decision": "approved",
  "decided_at": "2026-10-04T08:12:00Z",
  "owner_context": {
    "owner_id": "demo-noor-001",
    "device_id": "demo-basic-phone-001",
    "unlock": "sms_code",
    "confirmation": "text",
    "session_id": "sms-session-0001",
    "authenticated_at": "2026-10-04T08:12:00Z",
    "challenge_id": "challenge-0001"
  }
}
